"We read previous reviews . . which were poor . However , we ' ve travelled extensively around the world , mostly in Asia where we ' ve lived for over 10 yrs & sampled 0 to 5 star plus . For what you pay for this place there ' s nothing we could find to whinge ( complain ) about ! We paid Idr312k / £ 17 / nt incl breakfast . Breakfast was substantial . . . all the local fayre ( nasi goreng , fried veg with chicken sausage , mushrooms , pancakes ) fruit ( papaya / banana ) , tea / coffee , toast AND you can order your eggs in any style in addition to this . Damn fine ! The room was large , clean & has good aircon . A kettle , tv & daily 2x bottled water . The bathroom was huge . . maybe the only issue was waiting 3 / 4 minutes to run the water for a very hot shower . The balcony was big , bright & airy and had 2 chairs , a",886175366
"Stayed here for 1 night when we were unable to board our flight this week since it ’ s right by the airport . The rooms are disappointing , outdated and don ’ t seem very clean . No amenities aside from hand soap and bath towels . The ac kept our room cold but dripped all night , we had to stick a trash can underneath it and listen to it drip while we tried to sleep . We asked for a nonsmoking room but there was an ash tray in it ( didn ’ t smell though ) . The staff that brought us to the room was not friendly and didn ’ t help us with our bags up many flights of stairs , he just walked far ahead and let us deal with them . Breakfast was minimal and not very good . Only plus side is location and the pool . We paid hardly any more for a much nicer resort the night before , wish we had just gone back",751602005
"Was a bit hesitant to stay based on other reviews . Stayed in room 306 for $ 35 aus per night . Room was clean and well maintained , also room was cleaned daily . Great air con that chilled the room quickly . Staff were amazing also smiling and quick to joke with us . Very honest and highly recommend money change with great rates directly opposite the hotel . See Bec in the shop next door for SIM card for your phone . Close to lippo mall for the supermarket they are a bit pricey so only went there when I could not access the things I needed in Circle K . Great restaurants near by , if you turn left out of the hotel into the lane way , there is a fantastic cafe just down the lane way on the right hand side . The best pork ribs ever . Breakfast is included in the price but is basic . If looking",736659114
"We stayed here in Feb 2005 because it was one of the "" package deal "" hotels listed on our booking . We didnt expect much as it was a lead in hotel but were very happy with the location . It had a clean pool by the meals pavilion . Mostly the guests seemed to be more the retiring type so it was very quiet day and night . It is located down a lane away from the main road which also helped keep it quiet . It was serviced by a strip of shops covering all the basics from internet access to t - shirts and art etc . on the way to the main road . It was also walking distance to the beach . Only a 10 minute walk to the centre of Kuta and in the other direction a fabulous and modern bakery and supermarket owned the Chinese Emporium . Surprisingly this shop presented as ultra western with",4393020
"I loved Bakungs Beach Cottages . A good budget hotel , which helped for me as I come from U . S . and flight is very long - - so I want to stay in Bali at least three weeks . The staff were all friendly and helpful . I felt right at home there and enjoyed the other guests as well . Pool was great after a day at the beach . I encountered NO rudeness from any of the staff , and that is unheard of in this day and age . Everyone was eager to help , assist and just have a normal conversation . I travel alone for the most part and the hotel is safe and quiet . There are shops along the road and when you want something different than what is on the menu at Bakung ' s , there was a great warung just down the road to the left of Bakung ' s Beach Cottages . Staff was friendly there also . Right across",5438719
"We booked in to Bakung ' s Beach Cottages based only on price and the fact that we could get adjoining rooms as we wanted to have a two week holiday on a budget . Then we read the reviews here and were a little worried about what to expect ! It was great ! The rooms were basic and old , but they were clean , and cleaned every day ; roomy with a TV and small fridge , and the breakfast which was included in the price was good . The kids enjoyed the pool and we enjoyed the loungers beside it . The air cons were great and there were no bugs , insects or vermin ! The hotel is located about 5 mins walk from the beach one way or 2 mins from the main street and 10 mins walk to Waterbom Park and Discovery Plaza . We walked up and down the lane at all times of the night with three young kids and never",105053946
"The hotel room itself should be 4 stars ! : ) it ' s great value for money ! Unfortunately the restaurant in the hotel is shocking ! It deserves 1 star ! The double room was great - it ' s spacious with a big bathroom , flat screen TV ( with cable - good choice of channels ) , big balcony , fridge , wardrobe and free bottles of water every day . The rooms were cleaned very well every day even if you asked them to come back at a later time . We arrived at 3am but checked in fine ! The location is good and quiet down a side road . It ' s right next to the Lippo Mall ( 2 mins ) which has a supermarket , cinema and restaurants . It ' s a short walk to the beach - however this is down a shady alleyway where you wouldn ' t like to walk at night but it ' s fine in the day . With our room price we had free",340119793
"I stayed here for the 1st time late 2011 into 2012 and overall this place is pretty good . iI am not one of these people who spend alot of time in my room , but when you are in there the bed is clean , sheets change each day and the room is cool from the A / C . Now we go to the pool area which is great , the water in the pool is clean and around there during the day is quite social with the other guest staying there . The pool bar does not open but the restuarant is right there if you want a drink or food . The gardens around the hotel are amazing . So guys this Hotel is very safe nothing was ever touched in my room , and everyone is pretty friendly . NOW its not the Ritz Hotel , But for the budget travel person its really good . . . Just saying ! Jiffy",124637732
I have stayed at Bakung Beach Cottages several times over the past 3 years . It is an adequate stay for the Traveller on a budget or someone just looking for a nice cool room to rest between sessions at the many of the islands clubs . To all out there who label it the worst place or horrible I suggest stop being a cheapskate and fork out the extra $ 250 for something 5 star .,121724578
Best budget hotel in Bali fantastic staff from management to cleaners couldnt do enough for us . Hotel needs an upgrade but for the price you pay well worth it . We wouldnt hesitate to stay at this hotel again speciial thanks to manager Nyoman a truly special man .,117884167
"Doesn ’ t make much sense to be booked into your flash south Bali hotel / resort first night if your flight arrives post 20 . 00 – you have paid for the great view , rim pool , gym , restaurant yada but all you will see on late arrival ( add at least an hour for the airport and the trip from , although the latter can be much more in South Bali ' s horrendous pre - midnight traffic ) is the inside of your hotel room for a short while ( hopefully ) – before the zzzzs kick in . Way better to head for a near - airport lower midrange place with quiet comfy rooms . Which BAKUNG does well . Similarly if your flash resort is anywhere north of halfway to UBUD or south - west of BALANGAN , you don ’ t want to spend more than an hour ANYTIME OF DAY squashed up in a cab or resort shuttle after a long tiring flight .",685101496
"In about 20 trips to Bali this is the worst hotel I have stayed at . Thought I would try it for 2 nights as the pictures through Agoda ( & other booking sites ) looked good . I have stayed at a lot more expensive and a couple cheaper . In my second room after complaining about the 1st and am now looking forward to tomorrow morning to book out and go elsewhere . The rooms are dirty , the not plugged in fridge was filthy with mould and other substances in it . The sheets and towels - which none have been left from making the room up this morning - are threadbare and a dirty colour . Have just watched 2 older women cart their bags up 3 flights of stairs . Staff are not rude but of no help . The rooms I have seen are old and depressing with no safe to lock things in . Breakfast is just passable",295558103
"I ' m writing this review at the same time as we are staying here . This is a place that is clearly on the way up . We noted all the bad older reviews before we got here and the better recent ones , and that pretty much tells the story . It seems there must ' ve been LOTS of improvements over the past few months . Yep , there ' s still a bit to go , but for the price , this place is a gem . Nice pool w / swim up bar , clean rooms with king size beds ( and air con ) and lovely gardens , it ' s a perfect place to radiate from for your Bali stay . The cons : Water pressure a little light on the top ( third ) floor . Still some broken tiles in the pool ( though they ' re not really dangerous ) . Breakfast choices maybe a bit lean for some . The odd mangy cat floating thru the grounds . The pros : THE PRICE ! We booked",227816563
"I have stayed here each time I arrive in Bali and find Bakung ' s Beach Hotel to be comfortable and affordable accommodation close to the airport . This is really convenient when arriving later at night as it saves a long trip in to the Kuta / Legian area at a time when the traffic is not flowing quickly . There are also two shopping malls close by . The new Lippomall is right next door and the Discovery Mall a 15 minute walk away . Bakung ' s Beach Hotel is not on the beach but quite close and access to the waterfront is possible through the Pantai Inn restaurant grounds . The rooms have a small fridge , cable TV , bedside tables and good bedside lighting . The cupboard space has varied in the different rooms I have stayed in . Each room has a terrace area with a table and two chairs . The",209982822
"Checked in to this hotel last night and we had paid for 2 nights . The room was filthy and smelt of moth balls . I didn ' t want to use the bathroom or lay my head on the pillows . It was so terrible that we decided to move hotels . The hotel advertises its rack rates at AUD $ 60 , but you can find it advertised for cheaper on other sites . I ' ve travelled in Vietnam and stayed in budget accommodation , paying around US $ 20 per night . ; I wouldn ' t pay USD $ 20 for this place , or anymore than AUD $ 15 ! I don ' t think it provides good value for money . It would be an okay place to sleep if you can overlook its tiredness and general grottiness . Given the competition for western business , this place needs to lift its game .",107068313
It ' s a hidden gem tucked away the reception is a decent climb up many stairs you are greeted with a refreshing smile and very cold drink . The rooms are very neat and clean this hotel recently had an upgrade and the bathrooms are very big and clean the restaurant is basic but the food is amazing the best is the MI goreng the pool is very large and has a swim up bar . the beach is about a 5 minute walk and the main street is at the end of the lane all the stall sellers on the street are lovely for a cheap hotel I can ' t knock it I have been to this hotel about 6 times and I ' m drawn back by the relaxing feeling I get from it,467159630
"Excellent location right next to the new lippo mall . We had a room the backed into the mall and the motorbikes starting at 6am going into the car park and all the talking behind us was painful . Room was not cleaned to my liking . Breakfast was poor at best . Stayed with friends who woke up covered in bed bug bites . Kids used the pool and within seconds were screaming about the water in their eyes . Told them just not to put their heads under the water , but then when they got out the were covered in chemical burns ( all the kids 6 in total so not just a one off child with sensitive skin ! ) the pool bar was not open , and restaurant staff would not even walk the two steps down yo the pool to serve us drinks . Checked out and told staff all our issues , and no apology just said no refund .",304503322
"I have used this property in the past for a stop over being close to the Airport & Kuta attractions which makes life easy . Booking online has been easy & so affordable that there is money in the pocket to get out & see Bali . People that put up bad comments about this place must have expected four star resort at a Budget price ? I just brought my family here on my last visit , we had two connecting rooms & went out and did tours during the day & home to sit around the pool . Kids loved it . New Lippo mall next door . Resturant Pantai down on the beach & it ' s 6 , 000 rup ' s ( 50c ) to catch a blue cab to Kuta square . We also stayed in a luxury resort as part of our Bali holiday but we will be back to Bakung Beach again in the future .",217696913
"For a surfer this is a great location just 100meters to the boats out to the kuta reefs . I have been to this hotel on numerous occasions and the staff have not changed and are as friendly as always rooms have been painted , bathrooms updated and satelite TV installed also buffett breakfast that will keep you going if you are on a budget and happy with a simple menu . Bakung Beach hotel is not the Hilton but the $ 1500 i saved went a long way to my wifes Shopping and my Bintang expenditure . Pool and area around pool have been refurbished with new lounges . If you want to stay and lie around the pool all day and stay in your room hrs on end then go to a five star resort , but if you need a base to shower and catch some sleep in between your touring and shopping that is clean and",207804376
"I ' ve stayed here a number of times now and every time it ' s a great experience . It is evident with the influence of my long time friend Robert Rajendra , the GM of the Bakungs group of hotels , this humble hotel is reaching for the stars . My first experience was with fairly dingy rooms and a breakfast menu that was laughable , albeit sufficient . The hotel has undergone significant building renovations and very recently , an upgrade to the guest facilities that incorporated a complete make over of the pool area . The introduction of a coffee corner , swim up bar revamp and overhaul of the breakfast menu makes the Bakungs outrageous value for money . Close to the airport with transport arrangements it ' s a ripper . Yes , there ' s still the quaint engineering skills which bring a smile ,",207070237
"It all depends what you are looking for ! We have been coming to this hotel now for a number of years and although old and in need of a good upgrade it is happening . We are currently staying here and the manager showed us one of the rooms that are almost finished being upgraded and what with the new tiling floor to ceiling in the bathroom . With new washbasins and toilet pedestals lovely floor tiles throughout , the finished product will be lovely . We are . pensioners and can not afford to stay in the other upmarket hotels and would recommend this hotel to anyone who are not over fussy . I can not speak more highly of the friendliness of the manager and his staff ( and no I am not on the payroll ) . Pool is lovely and the gardens pretty except for the moment while the upgrade is in",142685672
"this was the first time staying at Bakungs and have to say that i was suprised . after reading the reviews was expecting the worse , yes its old and a little mouldy but the air con worked well and the sheets were clean . the staff are friendly and the highlight had to be the breakfast each day . considering how little it cost to stay i have paid more and stayed in worse . for those who see the room as some where to sleep and save their money for shopping i would recommend Bakung Beach catherine",130559223
"I stayed here for a week with a friend on my uni holidays . Since we were on a budget , I was quite sceptical about a low star hotel . The hotel is absolutely beautiful , with amazing gardens , beautiful Balinese architecture and a great pool . The rooms are very basic , but totally fine . Comfy enough beds , good air con , good shower ( although the bathroom was very small ) and a TV . The only problem was that the walls are quite thin , and the floor is made of tiles and often we heard out neighbours ( moving furniture ? ) in the middle of the night and yelling / partying etc but I guess that was just bad luck . Staff are also very friendly and helpful .",116001939
"havent heard the best things about bakung but I really enjoyed my stay . . staff were fantastic so happy friendly and helpful , the rooms were cleaned everyday , room was basic with a bed small tv mirror and bathroom the balcony was nice to sit on and look at the beautiful garden . . . the pool was really nice a decent size with a kiddie area but the tiles are abit slippery and some corners are a lil sharp . . . breakfast was pritty basic but decent to get u through till lunch u cant expect to much from 20 bucks a night i really enjoyed my stay the staff definetly added to the experience",92852386
This hotel is a bit run down but it is cheap and ideally situated . It is only a short drive from the airport which is what you want when youa rrive jet lagged ! It is 10 minutes walk to the beginning of the main Kuta area and five minutes walk from the beautiful Tuban beach . The thing to do is by some bleach and clean the bathroom to your own standards . Don ; t get me wrong - it is not filthy ! but you will feel better if you do this . Make sure the grating is fixed over the drain in the bathroom otherwise you will get rats coming up through the hole . Bali has many rats and Bakung ' s Beach has its fair share . Free entertainmentt is watching them running along the rafters . The cats seem to ignore them ! ! The hotel has a good sized pool . We didn ' t try the food but for excellent,74857121
"Booked two rooms for our family and were very pleased with our stay . The rooms were very basic but served their purpose as we did not spend much time in them at all . We had to ask for pool and bath towels as sometimes they were not left in our room . The pool area was lovely although they need new and more sun lounges . The breakfast was very basic and gave you a choice of egg styles i . e scrambled etc . bacon or ham , toast or honey pancake . Or Asian breakfast ( which we never had ) . The honey pancake was very good . We ate a few times at the restaurant for snacks and dinner and the food was very good . In particular their pizza wasdelicious especially the ' alla romanna ' . The trip from the airport was only about 10 mins and we were within walking distance to Centro and",29162261
"This is a horrible place to stay ! I booked here to be with friends who had booked a stay . I should have left after the first night . Room changes because of the poor condition then air conditioning breaking down . Dirty bathroom and poorly operating hot water ( too hot then too cold ) . The breakfast is rubbish . Pool was over chlorinated , and not enough deck chairs . If you want a hotel with a nice pool , this is not it . On the positive it is beside a nice mall . However , if you happen to have a room backing onto it the car park is noisy at night like a construction site . Poorly lit rooms and very basic . At night I could here rats or squirrels in the ceiling . I ' ll give credit where credit is due , see my other reviews , but a stay here will put a dark cloud over your",493882930
"Prior booking I read numerous negative reviews of this place . I knew what I was getting myself into but decided to go ahead due the close proximity to Lippo Mall , Kuta Beach and to the Bali night life . I have to agree that a lot of what other ppl mention in the past reviews were true but it was not all that bad . Since I am out the entire day and only come back late at night to sleep I am pretty pleased with the place . Yes , on my first night the air condition leaked and the bathroom was clogged but it was quickly resolved by friendly staff members . Breakfast was decent and nothing to complaint about . I would recommend this place to those who just want a decent place to come back to to sleep after a long day out and about traveling and shopping around Bali . If you are looking for",492638943
I love everything about this hotel . Just 5 minutes walk to the beach . Easy to find the food around . Near to Ngurah rai airport . Next to lippo mall kuta . My room was big and already renovated . I ' ll be back for sure .,457745719
"Both my wife and I had a fabulous time for 2 . 5 weeks in room 709 - so the top floor with a fabulous westerly view ( over and through the coconut trees ) of the sunsets . The room was clean , comfortable and tidy with a small fridge , good sized balcony and a decent sized TV with all cable channels available and the aircon worked perfectly . Shower water pressure at times was low . The staff ( Marni etc on the front desk to Wayan , Wayan Sari , Ayu and Argung looking after us at breakfast - to name just a few ) were lovely and so very happy and always so welcoming . Thoroughly enjoyed the breakfasts and the pool . The hotel location was also excellent for us being so close to Lippo Mall for shopping , a lazy 15 minute walk to Discovery Mall and Kuta , 5 minutes to the beach for a sunset walk",324315173
It is a fine hotel central in the Kuta South area nothing fancy but clean and tidy . This is a good hotel if you are on a budget or just want to do it cheap . The staff are great people pleasant and will have a bit of a laugh with you . The food is good and the hotel is central to lots of shops and restaurants . There is a bar and a swim up bar as well gardens and rooms well maintained .,323343135
"Stayed for a week . Rooms were clean , grounds were neat and tidy , staff very friendly and could have a joke with you and food was good at a good price . Was a good location and not too noisy . Will definitely go back and take kids next year , definitely worth the money you pay .",298999201
"If you ’ re on a budget this is excellent value for money in a great location . If you ’ re after 5 star luxury with a lap pool go somewhere else . Rooms – spacious with old balinese furniture . Bed was hard but comfy , extra pillows available on request . Air conditioner worked well . No bed bugs reported . Bathroom – as with all older resorts can be a bit smelly from the drain , buy a can of air freshener . Towels are old but clean . Will change , if not happy . Pool – quite deep in the main section , not over chlorinated . Can go green with rain , normally fixed asap . Pool bar currently closed due to water damage . Bar drink prices very reasonable . Breakfast – rotating 3 main dishes , toast , juice , eggs plus bacon on request . Can be boring if staying for a lengthy holiday . Staff – fantastic ,",250458639
"We first came here 12 years ago and keep coming back . Rooms are comfortable with aircon and a balcony . Excellent pool and friendly staff . Cooked eggs , selection of 3 hot dishes , fruit , fruit juice , toast and coffee for breakfast , all for Rp50 , 000 if it isn ' t already included with your room rate . Only a few minutes walk to the quiet Tuban Beach away from the madness of Kuta and the same distance to the beachside Pantai Restaurant . Great food at a great price . . . we just kept going back ! For a far more up - market or special occasion meal or drinks , there is Ma Joly right next door to Pantai . From Bakung you can walk to the Discovery Centre or Kuta along the beach walkway instead of the busy street . Plus there is the large Lippo Mall right next door .",247485586
"I booked for 2 nights as a layover at the end of my holiday . Arrived at lunchtime with my two children ( 6 & 8 ) and was shown to a double room despite me asking for enough beds for three people . After much negotiation I ended up with two single beds . They wanted me to pay for an extra single despite booking for 1 adult and 2 children . Room at first glance was acceptable . Then it just went downhill . - doors are not sealed and have big gaps under and around so mozzies just fly in and out as they please . - floor was filthy , sandy and grouting is gross . - wardrobes are circa 1950 , smell terrible and don ' t close . - lighting is appalling . They flicker crazily and yet at night the room isn ' t dark at all due to the windows over both doors and lights on outside . - bathroom",237192799
"This is a cheap hotel in good location with reasonable rooms but we found ours on the 3rd floor to be a bit noisy as it backed onto the car park and air con units from the new Lippo Mall next door . The rooms are well fitted out and are reasonably clean , do get the normal Bali smell coming up the shower drain , fixed by putting rubber door mat over it . The pool is only small and there is not enough sun beds and shade for the amount of people who wish to use it , it also has no pool towels so use ones from room so have to ask for extra towels . The breakfast is limited and caters more for locals , rice and noodle dishes along with toast etc and fruit . You can ask for eggs any style and bacon but no variety . Generally the staff were great and helpfull but found reception hard to",214747320
