"Well what can i say the hotel is amazing for the price . . $ 23 a night including breakfast . . . It doesnt get much better than that . If this hotel was closer to the main Kuta drag you would pay at least $ 60 per night . Location is great if you are wanting to surf Kuta reef . 5 mins on the scooter and your in the heart of Kuta . Some great little shops , massage nails etc outside the hotel . Pool is fantastic , Rooms clean and modern , Free wifi , Sattelite tv . . Awesome . Breakfast is ok you have to ask for them to cook you eggs otherwise its just the buffet .",207448181
Nice clean and cheap hotel to stay in . The Room was a big room with a balcony to sit and watch the world go by . Comfortable and with hot showers . Reception area was a bit of a nightmare as it is at the top of some stairs .,201968109
"After looking through the reviews I must say I completely disagree with KYLIES negative review . If she wanted 5 star service she should ' ve paid for it . Well located off Jl Kartika Plaza 5 minutes from Nurah Rai International airport . This budget hotel has improved immensely since the arrival of the new GM with experience from a close by 5 star resort . Don ' t let the price put you off , the staff are always smiling , friendly and willing to help . The rooms have recently been renovated . If you don ' t like your room on arrival ask to be relocated . I feel this establishment is rated very fairly and I ' ll be surprised if by stays end you haven ' t enjoyed yourself .",186211023
"We stumbled across this hotel on agoda and got a very cheap deal . The rooms are large , clean and spacious and have comfy beds ! Hotel is very central and very close to the airport . Downside is the restaurant is not great and there are not enough sun loungers by the pool . The service is fantastic from when you arrive , staff are warm , welcoming and helpful .",184207132
"We were greeted by a friendly security guard and were checked in quickly with a welcome drink . The porter and security helped us carry our bags to the room which was nice . We stayed in a deluxe double room and it was OK . It was clean enough with a bed , wardrobe , tv , shower , air con and balcony with a view of the pool . The room was cleaned daily and we were given bottled water each day . There is also free wifi which was good . The bad thing about the room was that we had a connecting door to another room and we could hear everything they said and the tv which was annoying at 7am when we wanted to sleep . We paid for breakfast and there was toast , fruit , rice , noodles , juice and hot drinks . You can request an omelette or other eggs if you wish . We ate in the same restaurant at lunch",176944786
"Bali obviously has some very impressive resorts on offer . Although this isn ' t one of the typical 5 star places , it is definitely more than enough . It is fortunately located at the quieter end of Kuta , but a short walk if you want to go into central Kuta . Staff very friendly , rooms basic , but have everything you need - comfortable bed , air con , TV with multiple channels , and wifi . The pool area is nice , and great after a morning surfing . They could provide a few more sun loungers though . Overall a great budget - luxury place to stay - really great value for money . This place suits couples on a budget that have done the whole hostel thing a few years back , but still like backpacking . Close to a really great surf spot ( accessible by boat . )",171419976
we stayed there as a party of 3 . booked efficiently through asia rooms . VERY REASONABLE PRICE - APPROX 35 USD PER SUPERIOR ROOM - very attentive and kind staff . grand entrance with a 4 star pool . rooms were comfortable but yes a bit dated but we liked the outside space overlooking their gardens . un pretentious atmosphere . mixture of young and old just enjoying the atmosphere and location - 5 minutes either way to kuta beach or down town . 2 star prices for 4 star comfort ! ! ! ! !,150752275
"I came with my family to Bali and decided at the last minute to stay in Kuta on our last night . it was the last day of the year , and all the nice hotels we inquired were fully booked . We surfed through internet and found only this hotel in the Kuta area that still have available rooms . we were quoted Rp600 , 000 / room / night . When we went to check - in an hour later , we were told the rate was Rp700 , 000 . After we insisted that it wasn ' t the rate we were initially given , the unfriendly lady behind the counter finally gave in . When asked if we could get adjacent rooms , she said ok . But when we got our keys , we were given rooms at different floors , and she had no courtesy to even explain or apologize for not being able to give us what we requested . She required cash for deposit so i gave",148688286
"Ok now this place was old but it was cheap and it matched its dollar value , the rooms were clean and the bathroom as clean as they could get it , but the bathrooms are in seriouse need of an up grade , but back to $ value again it ' s ok . The towels were clean but grey . One thing that was weird was all the light switches were filthy , they took the trouble to clean everything else but these looked like they hadn ' t been cleaned for 20 years , I just sprayed them with glen 20 . The pool and the grounds were lovely and staff polite but not over friendly like Balanese normaly are . I ' d still recommend this if your on a budget , you don ' t spend much time in your room . PS no coffee or tea facilities in the rooms or water .",130403625
"Stayed here with 2 of my siblings , booked 8 nights for £ 169 which was an absolute bargain ! It is spacious , big pool , large rooms and so close to everything such as shopping malls , markets , beach etc . Overall had a good stay but it is a little tired . Some missing tiles in the pool , not enough sunbeds for such a large hotel & room not really as described . We expected to have a deluxe superior room with 3 single beds in as that is how it is described on booking . com but we just had 1 double bed with 2 mattresses stacked on top of each other for the 3rd bed . Not really good enough & we probably wouldn ' t have booked had we have known this .",596478186
"You get for you pay for at Bakungs . You get AC and the balcony often comes with garden view . The rooms are just clean enough , some are better than others though and very simple . The drain in the bathroom doesn ` t work well and the water can be boiling hot . But it ` s walking distance to the surf , it ` s quiet and yet close to the main road , Lippo mall and restaurants . There is a nice pool and a beautiful garden .",581303283
"What can I say . Overall the hotel is bad . At night their are no lights to help you to see where you are going . You have to climb up so many stairs to get to the main reception . The service is shocking , not very heplful . Not for the handicap person or the elderly people . The pathway is dangerous and not level at all . slippery when raining or wet . You can either choose to use the steps or the steep path to go down to the rooms . You choose . There are no lifts only more stairs to get to the first floor . The rooms are very basic . The bedding was hard . The bathroom was as basic as it comes and dirty . No kettle and the air was loud and it was very hard to fall asleep . Next morning we went for breakfast with my sister and her husband . It was an average breakfast . Would not recommend",549405211
Quality of premises is bad . Staffs are friendly but not knowledgeable . Definitely not handicap friendly . Bedding was hard . Towels were clean . Breakfast isn ’ t recommended at all . There ’ s a good and cheap massage place right across the road though .,544278109
"We ' ve booked a room for 3 persons . When we came in there were only 2 beds and one matras on the ground . The pictures on the website did show uw a room with 3 normal beds . When we ' ve asked for a normal bed it was really difficult to get it . The staff were really unfriendly at the reception , haven ' t seen a smile at all . Eventually we ' ve got the extra bed . The rooms were really dirty , there were a lot of string of hair on the ground . Like if they did not swipe the room for a month . We had cockrouches in our bathroom and a lot of mult . Also the shower was cold . The fridge did not work at all . The only nice thing was the pool with the bar inside . We were glas we ' ve only booked for one night . Never going back to this place again , no one should .",531121159
"We Booked 4 rooms , 2 with extra beds for our family . The pool whilst large had many broken , sharp tiles and the ph levels were obviously well off as many eye and skin irritations . The rooms whilst spacious were poorly equipped and bathrooms in a very poor state . Air cons worked quite well . Tom cats everywhere which urinated on 1 of our doors leaving an aroma which could not be removed and infiltrated the room . Breakfast was adequate but not great . Worst feature was the shocking bed bug bites our 9 year old received . He was covered in them and his holiday quite spoilt . This is a low price hotel and we didn ’ t expect a lot but this issue was inexcusable .",530082607
"I am still currently ill from visiting Bali 6 months ago and I feel like this place has a lot to do with it . Our room had two single beds pushed together . Breakfast was terrible as bees were everywhere . Over 4 cats that will literally walk into your room but all were very lovely . Two male staff members were so lovely - they added us on Facebook at the end of our trip but upon going through their photos they go though guests rooms and take funny pictures with their items - alcohol , sunglasses . I found this very unprofessional . Bathroom was clogged and sewage came up the shower drain . Was told this would be fixed - it took the whole day and stunk of poo . The next day the same thing happened . Went down to reception and got placed in a new room - no problems with clogging in this",493740830
"recently stayed at Bakung Beach Resort , Do not give them your bank account details they access your account without your knowledge charge a extra day plus $ 10 not sure what that was for and refuse to give back the money ) is no way I would recommend anyone to stay here it ' s true what they say you get what you pay for but you certainly don ' t expect this , there is no jug or coffee facilities , would not stay there with children , The kids pool has tiles falling off it my daughter picked out tiles and would ' ve filled half a will Barra , There is a swim bar but however it ' s not open , The surrounds around the pool is dangerous , I watched a woman fall over poor furniture and split her head open got wedged between the steps going into the breakfast room and the pool surrounds",487680012
"last holiday to bali we stayed at two hotels , , , one at the upper end in price . it was great . we enjoyed it very much . all that you really pay for was given to us . . we have stayed at bakungs a few times over the years and love this hidden gem of a hotel . i have made over 60 trips to bali since the 1960 s and seen it all . the people at bakungs are the best and so is this hotel . we always come back . ive taken my kids there when they were young and they had a ball . it is a budget hotel but in my view you get what you pay for but bakungs offers more . . my wife and i will be back there in july 17 and i cant wait to see all those happy faces again . for the critics i say get a life ! ! !",487192308
Rooms was average but for the price what u expect staff nice Pool was green and got rash but if its working normal its fine pool bar is ok Sum rooms are renovated now so thry would be alright I will find out in june what new rooms are like staff are freindly,475201985
"I stayed for 5 Days 4 Nights during the Christmas . Its a budgeted resort with swimming pool , within walking distance from Kuta beach and Lippo mall . Housekeeping team is good always quick and clean for cleaning our room . The breakfast is not that great we only had for one time and choose for get best to get something on the street or in the mall by walk . I think it is old properties so you can imagine . Over all , good value for money , location is great",450591603
"Great a / c huge beds , clean , quiet , TV with satellite , pool swim up bar and includes breakfast , just 100m to Lippomall . Lots of surfers stay here as it ' s very close to the boats that go out to Kuta Reef . We have stayed a number of times generally for a month at a time . The price is great for long stays . I access most places by walking along the beach path only 10 minutes walk to Kuta for sunset drinks at the beach bars .",440771094
"I stayed , here , for 3 nights ; and , loved the location ( close to airport ) , ambiance , and , newer features in my room ! I discovered this small family - style Balinese hotel , while roaming the streets in the Kuta area . Amidst larger construction ; and , behind the "" Lippo "" Mall ; this hotel was a jewel in the rough ! ! The hotel has a lovely pool , gardens , and , interesting Temple ' s ( for the staff ) . My room has 2 single beds , ( very comfortable ) , a balcony with 2 chairs and a table and drying rack for laundry / wet suits . The tile floors were spotless , and the whole room seems to have been recently renovated . My only dislike was the shower in the nice sized bathroom . Their was no shower curtain or shelf in the shower area ( for your soap and shampoo ) ; so , I had to place these items on",434515617
"This hotel is good for one ' s a budget , nice pool with a swim up bar , rooms have flat screen T . V and a bar fridge , close to Lippomall walking distance to Discovery mall and water bomb park and resturants",430439032
"We stayed in this hotel for 6 nights in October 2016 . Here are some of the pros and cons of our stay : Pros : Location - it is conveniently located in the same street as the Lippo mall which has a nice big supermarket with everything you need . It is also very close to the beach and 10 minute ' s walk to discovery mall . It is 5 minutes ' drive from the airport . Pool - it has a very nice , big pool with a pool bar which is very cool Outside - the outside area of the hotel ( outside the rooms ) has a tropical paradise feeling to it , lots of trees , green grass , flowers - it really is just beautiful Bed - we had a very comfortable big bed Aircon - our aircon worked well Neatness - the room was neat and tidy and cleaned every day Breakfast - breakfast was included in our stay and we",426871952
"Room not ready on arrival until after 6pm , found opened 1 / 2 empty bottles of water , no towels , stained linen . . . grey & holey , 1 / 2 sheet on bed 3 nights out of 8 . A / c broken froze at night , wouldn ' t give extra blankets or pillows . Hot water very unreliable , sometimes hot , mostly tepid . Broken tiles in shower resulted in cut foot . BYO pool towel , lots of tiles in the over chlorinated pool also broken . Breakfast very ordinary , always running out of cutlery , glasses , plates , food , condiments . Some of the restaurant staff were good , others not . Free WiFi can only sometimes be accessed in lobby restaurant & pool surrounds , never in room areas . Found office staff not very helpful or nice . This is one place I will never return or recommend to anyone .",338089033
"for au $ 30 its very good value , includes brekky . We only stayed a few nights to catch up with friends before going to Candi Dasa . Sure there are some things that need attention but , this is Bali . Its a traditional structure , nice grounds , pool and restaurant . Again , rooms are very basic but given you don ' t spend all that much time there , who cares . Freindly staff , central position , close to the beach and Kuta Square close by . Super quiet at night , except maybe for some dogs barking now and then . Our room was on the ground floor , private patio surrounded by gardens . Close to the airport . The pool is quite large with a swim up bar . The main section is deep , 2 metres but joins up to kids pool . Not a lot of sun lounges , fresh towels can be scarce . Comfy beds , air con , tv , daily free water .",315473991
"We have be coming to this hotel for the past 6 years . It is in a great location , short walk to beach and Kuta Square . Has improved since the renovations . Rooms always clean . food at Restaurant not bad . Staff are fantastic , always helpful . Great garden surrounds .",303035548
"The rooms are simple , bathroom is not the cleanest I have seen , but ok . Beds are fine and clean . Pool area is nice , even though the pool has so much chlorine that I could not open my eyes under water . Breakfast is toast , rice or noodles an fruits . People are friendly and helpful . Location is good , 15 walking minutes to the beach with nice waves . Right next to a big moll . Enough restaurants and mini markets in walking distance . 10 minutes drive to the airport .",260967838
"Stayed one night and was surprised at the value for money here . Rooms are ok , aircon works great and I heard no noise at night . The pool was great , very big with lots of sun . Location not the best but only 20 , 000 cab to Kuta . Drinks at the restaurant were well priced with friendly bar staff .",241044724
"Two minute walk to the beach , which was awesome . But the hotel is located next to a shopping mall & the street is busy with traffic , suggest getting a room away from road as it ' s impossible to sleep , you hear everything ! Room was spacious , air conditioning worked great & the wifi was excellent . beds were very hard though & no safety deposit box to lock stuff up . However , nothing went missing while we were out . Staff were excellent , very happy & fun to be around .",240468031
Wasnt expecting much due to the price £ 17 a night we paid upon arrival we were greeted with a welcome drink and a smile ! Rooms were basic but very spacious with a balcony fridge air con and a tele and the room was cleaned daily with fresh towles provided ! The best part of the hotel is the pool and gardens really beautifull and well maintained ! The restaraunt is really cheap and the food is fresh and homemade ! The beach is the best ive ever seen and only a 5 min walk and the hotel is just off the beaten track of the lively and noisy strip and u cnt here a thing ! Loved our stay and would deffo go back !,233047764
"My husband and I recently stayed here for 3 weks . The location is perfect for those who want to be close enough to Kuta to shop , you can walk the paved boardwalk , or get a taxi for $ 1 . It is far enough from the nightclub scene that you aren ' t disturbed in the evenings . There are also a few places to eat closeby and a new shopping mall , Lippo Mall , next door . The rooms are basic but have all you need and they have a nice balcony for drinks in the evening . The breakfast was ok , with a few choices and when we realised we could get the food heated in their microwave it made all the differance , hot food . The pool was very relaxing set among the usual lush gardens of Bali . We will definately stay there again .",225589608
"This hotel is cheap and basic , rooms have A / C , TV satellite , small fridge hot water . The rooms are large and comfortable but dated . Breakfast is also basic toast fruit tea and coffee . There is a nice pool area . My husband surfs and this is very close to Kuta Reef and the airport . If you haven ' t been to Bali before I would suggest you look elsewhere . I found it fine but not the Ritz .",216138052
"I was captured by the 100m to beach description , yes you are 100 meters to the beach , but then another solid 1 - 2 km from the real beach . Walking distance to shopping though . Rooms clean , brekky is rice . Descent , but there is better for similar prices . I also didn ' t like the little ally it was on , as a blonde I was frequently harassed by store keepers . I would google map double six beach or hard rock hotel and pick places near them . Far from each other , but best beach locations .",215449835
"Myself and my girlfriend booked ourselves into this hotel last minute so choices were very short and this had the best recent reviews so we thought it must be quite a nice hotel ! Boy were we wrong ! We arrived and were greeted with complimentary drinks which was a nice start but it went downhill from there . We were showed to our room which was a rather long walk so my girlfriend had to carry her large travel bag all that way without an offer from any staff to carry it which was rather ignorant considering all other hotels we have been in so far have done that ! The room itself looked nice , however the a / c didn ' t work properly so it was freezing ! The showers drain was awful so water didn ' t drain properly ! The bed ' s mattress was really hard and I ' m sure some springs were broken ! The",208646889
"Our stay from 11 May2014 to 17 May 2014 . Superior twin Room . Although the Hotel now no longer has a beach front nor sight of the Sea ( a 5 min walk is now needed to access the Beach ) , this is a rustic and serene peace of property that is value for Money . For less than US30 with breakfast thrown in you get a restful stay after a hectic touring day , The courtyard pool and generous matured landscaped garden with total privacy from the outside is much appreciated . The Pool may be small but clean ; actually deep enough and nice with a small shallow section at one corner for children . One can even do some mini laps and soak away all tired limbs . Adjacent is a basic restaurant operating from 7am to 10pm and in the day a seperate coffee bar as well . The rooms are clean . , its really",206729556
"I stayed here 15 years ago on boys surfing holidays and just stayed again with my 10 yr old son and a mate . Rooms clean , ac worked , nice big balcony , maintained gardens , new shopping center next door for all your needs , quick walk to beach , massage and laundry across the lane Pool needs to be retiled sharp edges and alot of broken and missing tiles , more room around pool would be good Seriosly you cant complain when you pay $ 30 a night Yes i would stay here again",198975217
"Value for money . AC is good . Hot water is good . Very large bed . Large and spacious room , Friendly staff , Large swimming pool , Large garden , Good location , located right behind Lippo Mall Kuta , a brand new large shopping mall in Kuta . A lot of food available in their food court .",189571380
"Staff were friendly upon arrival but that is where the positives ended . The room was old & outdated & we had to go up 2 flights of stairs to get there . There are stray cats living on the grounds ( we saw at least 6 ) . The room was infested with Mosquitos & my friend had bed bugs in her bed . The room is noisy by day & by night , during the night all you can hear is traffic , screaming from the streets & power tools being used at all hours . We didnt even attempt to use the pool as it didnt look appealing & we went to have brekkie at the hotel restaurant but were stared down by other patrons / staff & the food didnt look good so we went elsewhere . This hotel is more of a hostel & would barely be fit for a backpacker . Save your money & go for something a bit classier because this",186794465
Simple small hotel and yeah they are not that organised at times but it is good location for the cost which was around Aus $ 25 / night . The rooms are basic and nothing flash and you might have to get some glasses for yourself but there are little almost private balconies or terraces . The bed is a little too firm but have had that at expensive hotels . there is aircon and a fridge . Location is tucked away from noisy street and close to beach and Kartiki plaza shopping / restaurants etc . Food at restaurant was basic but OK .,186596097
"my wife and i love bali , its culture and lifestyle . we wanted a traditional balinese hotel to stay in . this is bakungs hotel . not expensive , friendly with a nice atmosphere , beautiful gardens , pool and a nice restaurant . i have a bit of advice for new travellers in this new world . at check in ask to inspect your room to see if it is ok . if the room is not what you want ask for another . the staff at bakungs did that for us and our room was excellent . all the staff are just good people and we found them very helpful . like all hotels in the world there will always be problems for certain people . these problems are not difficult to solve . we love this hotel and i would have our next visit to bali penned in at bakungs hotel . thanks to all for a great time . we",183336044
"Nice family budget hotel . . . . nice little garden . free wifi in the room . good size swimming pool , but be carefull quite deep ( like it ) . . but no small child pool . Very basic breakfast . Location is very near to airport , just less than 10 minutes away . Good localtion in Kuta , walking distant to attractions .",182172474
"We stayed here for one night before an early flight the next morning . The price for the rooms was outstanding but yes it is a little tired and dated but clean enough . The pool was large and clean and the food very reasonably priced . I would consider staying here again as long as our room did not back onto the new shopping centre , as the air conditioning unit was loud and it was hard to get to sleep . There are a lot of stairs which you may need to consider if you struggle with them . Overall if you are not too fussy this would satisfy a family on a budget holiday .",181442748
