"By far the worst and filtiest hotel i ’ ve ever booked . Fungus and mold on the ceiling and wall , teared up sheets and towels , shower with icecold or bloodyhot water no inbetween , with no consistent flow , like somebody is pumping the water . Even when you dont pay much for the rooms , the least you can expect is clean rooms and clean sheets ( after a week they still didnt renewed them , i could tell by the stains , tears and smell ) . The worst thing of all , while we were out for an hour to lunch after we complained , they quickly painted over the mold on the ceiling ! ! See pic 2 and 8 . Though the manager was friendly and apologised , this hotel gave us the creeps . They offered us another room , but with such lack of hygiene we didnt even wanted to look . Who would have ? Never ever again .",565250884
"The hotel is not so far from the beach , however you need to walk a bit and not to get to the better beach on the surroundings . To get to the more popular beaches , with restaurants , surf lessons , street shopping and others you have to walk a lot . The best part of the hotel is the swimming pool , but the rooms are not the best . The shower has bad pressure but you have hot water , the breakfast is very simple but enough , the rooms are a little degraded but you have the simple conditions for a good stay for a few days . The hotel is not so far from Denpasar airport , however it is located on a dark road , with almost nothing on the close surroundings .",513902760
room were terrible bath room no water or it was so slow plus smell like sewerage the food was bad watermelon was off an use milk powder for milk an u walk around the place an it sinks book for 10 days an we left on second day an got no refund I will warn everyone not to go here terrible place,510846660
It was our last two nights in Bali and we have choose to stay at the Bakung Beach hotel . The ambience was good with the great pool . Even Beach was few minutes walking distance form the hotel . Those who wants to be close to the beach can book this resort .,506099272
"I was there for 3 nights and i love the location as it near with many attractions place . Food was ok woth affordable price . Unfortunately , the air conditioning was leaking . I informed the receptionist but he told me to put the towel underneath the air - cond . They didn ' t rectify it until we check out . The wifi was super poor , we were not able to connect wifi from our room . I think they should improve the wifi speed as many of guests from foreign country and rely on wifi .",467123462
"Average to bad in most things , not accessibel at all . Spartan rooms , with no separate shower , one shower and all of the bathroom is wet . Rockhard beds . One of the people in my group found a bedbug and other people we met told us it had happend before , true or not ? maybe . Sad breakfast .",458419269
"One of the worst hotels I have visited . You can make the assumption for the money not to expect much but it was horrific . Poor cleanliness , poor staff and poor location with the construction going on 24 / 7",440243057
"Located close to the airport and the bustling streets of Kuta . The street leading from the Kartika Plaza mall to the hotel is pedestrians only , so your cab may have a difficult time finding the access road ( on the beach side ) . Rooms are clean , but basic . Wifi coverage is not extensive ( just in the cafe / pool area , not in my room ) . Breakfast is basic , beers are cold and come in big bottles .",426023116
"We have stayed at Bakungs 5 times , always as a 3 day stop over on our way to and from Java . It is basic . . . very basic but for the price , it ' s well worth a look . 2 minutes walk to the beach and right at the airport end of the main road from Semenyak to Kuta , it has a great position . When it ' s time to leave , the airport is only 5 minutes away so there ' s no stressing you ' ll be late for your flight .",423382034
"We checked in for our stay , and straight away knew we were in for a crappy time ! Couldn ' t find our reservation , then didn ' t give us rooms together as requested , as we were travelling with teenagers . When we asked if we could have rooms together as requested in email , the lady at the front rudely told us we were lucky enough to get ground floor ! Got shown to our rooms , 1 was newly refurbished but air con didn ' t work properly and was in a dark corner with noisy renovations going on beside it . The second room , was in a dark corner at the other end , with a view from our terrace of old , broken wooden chairs and rubbish , and the sound of tiles being sawn beside us . Inside the room was mouldy , and the musty smell was making me choke ! Could hardly breathe ! Tv didn ' t work , mould up the",416051387
My 4 week August 2016 stay at Bakung Beach Hotel was our second stay from our 2015 stay . The staff continue to be friendly helpful and happy . The accomodation and breakfast continue to be reasonable value but please guys fix fix fix the murky green pool water . On most days of that 4 weeks 2016 stay you could not see the bottom of the pool it was so murky . The water was also stinging mine and other guests eyes similar to our previous stay but at least then the water was clear . This was pointed out to the front desk staff on a number of occaisions . The water should be the normal clear ' blue ' color of any normal healthy pool . There were the standard number of guest on the pool sunlounges but very few swimming this time . The pool area and water quality are ( very obviously ) one of,415518511
I was a little disappointed visiting Bakung again . Whilst this is not a top hotel it has gone down hill since last time I visited . The good points was the clean linen and comfy bed and of course the price . On the negative side the breakfast was not as good as last time with quite a limited choice especially with fruit . The biggest disappointment was the state of the pool . It was the same colour as the diving pool in Rio . . . . . . green . The atmosphere was quite dull with the swim up bar not operational on our stay . Anyway for the price it is a viable choice for an overnight stay near the airport .,412963629
"Stayed for 6 nights in August . The staff are really friendly and helpful , about a 5 minute walk to the beach which was always quiet when i was there , 2 minute walk to Lipo Mall which has a supermarket and foodhall on the ground floor which was handy . Airport is about a 10 - 15 minute drive . The room had lcd / plasma TV with a good selection of english channels including the Australia + channel which is good if you like AFL . Aircon worked well . Big balcony , minibar , shower with hot water and good pressure , room cleaned everyday . The only small negatives was that my room was interconnecting with the room next door so i could hear the neighbours sometimes and its about a 20 minute walk to pubs and clubs on Legian street .",412608777
I am currently staying at the hotel for a short vacation in Bali . It ' s located very close to the airport so one may even walk from and to it . ( 2 . 5 km ) . The pool is really nice and open till 11pm . I also suggest getting the breakfast because it offers a good variety of dishes . The staff is nice and helpful and the rooms are meeting the expectations . There is wifi around the pool for people who want to work and relax at the same time,412510548
"We went to Bakungs in July a family of four , the staff are amazing it is only a short walk to the beach there are great spas and restaurants very close to the hotel next door there is a shopping mall it has everything you need we have been going to this hotel for 10 years",410826776
"Spent 1 night here , not out of choice . Arrived at midnight , supposed to be picked up by the hotel . But when I arrived NO ONE WAS THERE TO PICK ME UP and I had no where else to go . Floors were sticky , door had a big gap between the door and the wall . The bathroom felt mouldy and yuck . Did not even use it . No in room dining . Aircon was a hit and miss . The room had no internet , I had to be right beside the pool to use the Internet . Worst part was there was no safe in the room . Hated every second here and would never go back .",409917693
This was my 2nd stay here . Spacious rooms friendly staff nice pool . I like the area . So close to LippoMall . Omelets at breakfast are really good . We had 4 nights . Very happy . They have cable TV air conditioning works well . Room serviced daily water each day .,405943768
"This place sucked hard . . . room was terrible , shower sprays everwhere and as another review stated goes from boiling hot to freezing cold constantly , staff were non existant , pool bar not staffed , breakfast ordinary , nothing going on at the end of the beach its located beers were a full 1 / 3 more expensive then the place we ussually stay we ended up checking out after 2 nights even though we booked 5 . . honestly if your looking for something in this price range try la walon in poppies lane , cheap , clean , great friendly staff always regret having to go home when we stay there . . .",400645716
"The entrance to the reception is a bit different : you have to take two stairs to do this . But the people are friendly an helpful in many ways . The room we had was large and clean . The bathroom , was allso large , but there was no space divider between the shower and toilet so nearly all of the floor was wet after a shower . No shelf for toiletbrush and such . Big balcony and adequate airconditioning . The hotel is situated 5 minutes walk from the beach , 2 minutes from the start of the buzzing main street with restaurants and 5 minutes walk from the first "" warung "" , the indonesian low profile restaurants . It takes about 15 minutes walk to the center of Kuta . Right across the hotel ( and in the same street ) are different shops : 4 tattooshops , a few small restaurants , toys & clothing and",382843184
"This is my 5th and last time at Bakung . I can put up with a shower that covers the entire bathroom floor including the toilet with water . I can even tolerate that rude woman in the reception or that they NEVER give me the room I request . I can even stand the pounding and noise from above . But enough ! ! The hot water contiuously goes from scalding to cold continuously without warning . The bed went from two sheets to one , then two singles draped across a bare stained mattress that you end up sleeping on because the sheets are overlapped and too small . The pool is literally green from neglect . Looks like an ear infection waiting to happen . Or the broken sharp tiles at stairs might cut you and do the same . When brought to the attention of staff they smile and shrug their shoulders as",380189440
"The price is reasonable , old style hotel , but the cleanness and hygiene of the room was unsatisfied . In Room ' s amenities are poor , there is no kettle nor compliment tea or coffee . The room is quite big with a balcony . Give up all your expectation before going to this hotel if you have to stay there , you wont be disappointed . However , I wont recommend this hotel to any , even it ' s good price , we can find something better with the price . Oh the hotel also offers very uninformative and unhelpful staffs yet they have a warm smile which calm us down anyway .",375447047
"I often come back to Bakungs beacause its cheap , clean has large rooms , cold air and a big pool . Staff are very friendly and it has a low key feeling . Its quiet and close to the beach . Breakfast is eat as much as you want indo and euro nothing flash but good enough . Endless coffee and tea . Walk outside to multiple restaurants massage spas and other traders straight outside the entrance , very handy . . Large modern mall ( Lippo Mall ) opened up next door with food hall and lots of shopping for the girls all a | c and quiet . Walk outside turn left walk 4 min and your on the beach .",373582848
"rooms are dirty after complaining about human was on toilet and dirt all over floor . it appeared on the up untill the next room which also just as bad photos appear deceiving as the place i stayed at was outdated and unkept . along with this the 2am wakeup call from securties family members and constant banging left my first trip to bali not a good one when asked if they have a shuttle for airport drop off pick up i was told know , however from the photos they do have a business van",372218158
"It is typical oldstyle bali accommodation , needs work but hey for $ 35 a night and i know others got it for $ 25 , for that price i would give it an extra star . The rooms are large , with not much else , the shower doesnt want to regulate between hot and cold . The pool area and swim up bar are great , although broken tiles . The breakfast is ok , order the omelets so good . Its out of the way from restaurants and bars and i like to be in the activity and have choices . Pay for what you get really .",371652288
I had a pleasant holiday at the Bakung in February 2015 for 15 days . Unfortunately it has taken me this long to sit and pop my review in due to contracting Dengue Fever during this holiday . I feel the water features and the area had something to do with this . I don ' t think I would stay at a hotel which has a pond again if I ever do return to beautiful Bali . It has been a whole year since being in paradise ! ! Anyway enough about me . . the staff here are just beautiful . Breakfast is really enjoyable with a nice selection . The pool is sunny most of the day and sparkling clean . My only complaint about the pool is they need to clean more regularly around the tiles of the swim up bar as it gets a bit dirty around the water level . Rooms are aged but lovely and clean as is the linen .,365890115
"We stayed here for 3 days whilst travelling around Bali . We booked it on booking . com but they couldn ' t find my booking reservation nor have a room ready for us when we arrived . Once we got to our room it was perfect for what we needed , large room with aircon , TV , hot shower and clean room . The next morning we went for breakfast which was only an extra £ 2 a day for the both of us we only ate in there the first day . There was nothing to offer , we only ate toast that morning . There was no cereal or egg , bacon , tomatoes , beans ect that you would expect to find in a buffet style breakfast . The only option was boiled rice and curry - not what we wanted at 8am ! ! The pool is beautiful , it was large , clean and went very deep - 3m I believe . There was a pool bar in the centre . Many",364504579
The staff were so rude . The room I paid for was not what I received I had a choice of twin or double booked and paid for double and taken to a twin when I pointed this out I was told to push the beds together . The cat excrement is every were and the smell is overpowering from it around gardens and pool . The breakfast was very poor and they were more concerned with me not presenting my breakfast voucher . tiles in pool quite broken and sharp I ended up checking out and going elsewhere for the same price and a lot my pleasant . There were to many incidents to mention but the worst was when one of my family were checking out and all paid up at 11 pm at night to fly home the women at reception started demanding what we were doing and wanting to know what room we were in and we,361731324
OK Here we go if your a stuck up traveler Dont STAY HERE . Its a BUDGET HOTEL That has great clean rooms great staff and location . Breakfast is average but enough they cook your eggs and nice bacon for you . Pool great gardens nice . AIRCON Cold Linen USED But Clean . 7 minutes to airport . NO SAFES IN ROOM you have SAFETY DEPOSIT BOXES WHICH WORK GOOD . Will use this hotel again if on a BUDGET . Thanks to all the staff it was a great time had by all .,336333562
"Good hotel with nice buffet breakfast , airco in room nd good bed . Reasonable clean , only smell from bathroom after heavy rain . Friendly staff . The pool has to much chloride in the water . Room is abit dark but view in the garden is nice .",334514834
"The hotel is clean and has nice park , the pool is also great . Also its near the ngurah rai airport about 2k , if you find hard to find this hotel just go to lippo mall near the airport its not far from there",304902620
Stayed at this hotel from 6august to 10 august . . Pool not so good too many chlorine . Food below standard . Staff front office very slow . Housekeeping staff very great ! ! They always clean the room everyday . Love it ! The place is Behind bloody lippomall Many mosquitos even you spray it the room . But this hotel is for couples or young people not so good with family with little children . Anyway thank you .,297686579
"We stayed September 2014 with another couple and are very much looking forward to staying again September 2015 . The staff we very friendly . Steven the manager went out of her way to make sure we had our sunset photos before our flight home . The location of the hotel is perfect for our needs . Lippo mall is right next door just down the lane is Pantai restaurant , there are loads of stalls in the lane way as well as some smaller warungs ( also very good ) . This hotel has a swim up bar , open air restaurant , free wifi , air con rooms and relaxing atmosphere . Looking forward bringing more of my family this September to meet our friends Agung , Dewai , Katut , and all the lovely ladies at the Bakung",295880012
"Stayed here from 21 to 24 July 2015 . For the price I paid ( around IDR 800 , 000 , - for 3 nights ) , this hotel exceed all expectations . Smooth check - in / check out process , friendly staffs , spacious room with balcony to boot , clean bathroom , mini fridge and water heater , and fresh towel every day . The pool was quite nice although the chlorine ' s a tad too strong for my liking . We were given a room in the back , near the Lippo Mall ' s parking lot but it was quiet so we had a good night ' s sleep everynight . And oh , there ' s a hypermart at the basement of Lippomall , you can get basically anything you need there . A 100 meters walk to the west will get you to a nice , quiet beach where you can enjoy sunset . Upon checking out , you can get an unofficial airport transfer for IDR 50 . 000 , - : ) Will",293166032
"The hotel itself was a disappointment . No phone service , and no Wifi . The service was ok but I guess you get what you pay for . Breakfast was very average . I wouldn ' t stay here again . The best I can say is that the pool was ok .",274932870
Perfect location from kuta beach and airport . Good price . Good facilities but not with the towel . I checked in at 12 am and they gave the towel maybe at 6 pm . The hotel behind the lippo mall so it will be easy to spend time for a solo traveller,274923658
"I have stayed at this hotel before mainly due to its close distance to airport . Bali traffic can be a nightmare and if you are at the northern end of Kuta , Legian or seminak it is impossible to say how . Long will it take to get to the airport . Depending on the time of day it could take 1 to 2 hours . I have heard stories of 3 hours . Bakung is only a short drive to the airy so you can get there quickly . The hotel is set off the Main Street so it is reasonably quiete . Rooms are basic but will meet your needs , flat TV , big showere Nd comfortable bed . Pool is too deep and over chlorinated . Breakfast is basis but meals and cocktails very reasonably priced . There is large shopping centre on the corner but overpriced . You can walk to the beach front in 5 minutes and along the main Kuta",269825412
"At jl . Samudera just 2 min walk from Lippomall and about 3 - 4 min from the beach is Bakung Beach cottages . It ' s clean , friendly and affordable . There is free wifi in the hotel . The breakfast is ok , you can choose from fried rice or toast with egg and fruit juice , coffee . It ' s a pity that the fruit platter is mostly each day the same papaya and watermelon . I really enjoyed my stay here . At the front office they have a safe . Better to change money in Lippomall as the exchange rate there is better .",266732643
"This hotel is cheap nice and tidy good location to every where airport , shopping , beach and water boom park . But no hair dryer and no tooth brush . The building is not bad . Internet was not worked in second day . They say all Bali connection was down . Average for every things is fair enough .",258190268
"loved our stay , walking distance from Lippomall shopping centre . Walking distance to beach . Wifi was reasonable and worked most times but weather played havoc with this , not the hotels fault . Bathroom water smelt but this is the water . Rooms were very basic and if you are a non - smoker then we would suggest you get a non - smoking area away from smokers as this made us feel quite ill . This again not the hotels fault and we did not complain to them . The bar , kitchen and cleaning staff were all awesome and reception easy to deal with . Enjoyed our stay very much . Thank you .",257576654
"As you were stepped in this hotel , you felt welcomed as the receptionist giving their positive gestures as they greeted you and welcomed you with their "" welcome drinks "" . The breakfast limited to 2 main courses dishes only , not much variety but i don ' t bother about the meals . The wait and waitress well organized but somehow i felt the services at restaurant were "" double standards "" as they mainly focused on "" foreign "" peoples while the others guest they didn ' t bother at all . I didn ' t mean that all the waiter and waitress but i did recall some of them . Too bad i cant their names as they didnt have name bagdes . Even though i were there for a week , but sadly they didnt recognized me and my names . They kept asked for the breakfast coupons . : ( But , i falling in love with your pool !",254001906
"This hotel is cheap . It costs me less than AUD $ 100 to stay for three nights . It ' s nice . I can get my own room and balcony and there is a pool in the hotel . There was a bad smell from bathroom drain . I think this hotel would be great for travelers with tight budget , like me . But if budget wasn ' t really an issue , then stay at a little bit more expensive one would be better ! According to Hotels . com , they should have wifi everywhere . But I can ' t get reception in my room or balcony .",241168338
The hotel is quite ok . only 100m from beach but it is quite hidden . need to ask for directions to the beach . we got a clean and spacious room with a balcony which overlook the garden . it came with a simple breakfast which was fine good enough . they could improve by providing mosquito spray or something as there a lot at night in the room even though the doors and windows were shut all the time . water pressure in the bathroom could also be improved . other then that we had a good stay .,239873433
"we spent 3 days there , booked just 5 days before , 15 euro a night really nice pool and bar pool , quiet place , mixed people , nice indonesian food at the restaurant ! good breakfast ! Nice people easy to get Kuta center and the beach !",239453375
"We booked in advance and requested single beds in a ground floor room ( 2 ladies travelling together ) . We arrived to a double bed upstairs . The pool was way too warm and not at all refreshing after a hot day out . Then on day 3 of our stay the pool turned turned green . Nobody could tell us when it would be fixed and didn ' t seem at all concerned They didn ' t stop people swimming even though it was highly likely you could get amoebic meningitis if the water went up your nose . We departed after three days of no swimming . Not happy . Also they forgot to give us towels every single day . How hard is it ? On a positive note , the breakfast was simple but good . I definitely wouldn ' t recommend this hotel to anyone wanting a guaranteed fun hotel . I know it was cheap but you still",238581625
"The hotel is a typical older style Bali hotel ; the rooms are large with reasonable furnishings , comfortable without extravagance . The breakfast was at best ordinary , but for the cost adequate . if you required better you would pay more , or use the local Warungs . Restaurants and shopping are within reasonable walking distance , but for the bulk of entertainment venues , take a taxi , Bluebird preferable as meter "" dos not gallop "" a charming local term . The beach is a short stroll down the lane ; a walkway that takes you all the way to Kuta with access to most shopping venues is a pleasant place for walk or just to watch the beautiful Bali sunsets . We found the hotel gardens and pool area a very pleasant area to relax in and like most holidays it is what you make it . We have visited",237035056
"There are some really good pros with the property - price - location - staff - pool area - breakfast included However the negatives outweigh them and while this place would be perfect for a boys weekend or the budget conscience , I would look elsewhere for a more intimate environment . The cons - dirty bathroom - rusty pipes - bad water smell - breakfast quality and variety I was unsure if to go 2 or 3 stars , on the last morning they forgot my omelette and then they changed the ( please make my room ) to do not disturb . The staff are lovely and at the price you can launch yourself into Kuta . Pool area is brilliant and bintang was 25 , 000 for small and 35 , 000 for large so vary well priced !",235337008
